,Book Title,ISBN,Amazon URL,GoodReads Description,Riffle Description
108,"The Battle of the Labyrinth (Percy Jackson and the Olympians, #4)",9781423101468,https://www.goodreads.com/buy_buttons/12/follow?book_id=2120932&ref=x_gr_w_bb&tag=x_gr_w_bb-20,"Percy Jackson isn't expecting freshman orientation to be any fun. But when a mysterious mortal acquaintance appears at his potential new school, followed by demon cheerleaders, things quickly move from bad to worse.In this fourth installment of the blockbuster series, time is running out as war between the Olympians and the evil Titan lord Kronos draws near. Even the safe haven of Camp Half-Blood grows more vulnerable by the minute as Kronos's army prepares to invade its once impenetrable borders. To stop the invasion, Percy and his demigod friends must set out on a quest through the Labyrinth - a sprawling underground world with stunning surprises at every turn.","NOTE: Cover art may vary and cannot be selected.  As an incoming freshman, Percy isn't expecting his high school orientation to be any fun. But when a mysterious mortal acquaintance appears, followed by demon cheerleaders, things quickly move from bad to worse.   In this fourth installment of the blockbuster series, time is running out as war between the Olympians and the evil Titan lord Kronos draws near. Even the safe haven of Camp Half Blood grows more vulnerable by the minute as Kronos's army prepares to invade its once impenetrable borders. To stop them, Percy and his demigod friends will set out on a quest through the Labyrinth-a sprawling underground world with stunning surprises at every turn. Full of humor and heart-pounding action, this fourth book promises to be their most thrilling adventure yet."
109,Plain Truth,9780743275019,https://www.goodreads.com/buy_buttons/12/follow?book_id=14864&ref=x_gr_w_bb&tag=x_gr_w_bb-20,"The small town of Paradise, Pennsylvania, is a jewel in Lancaster County - known for its picture-postcard landscapes and bucolic lifestyle. But that peace is shattered by the discovery of a dead infant in the barn of an Amish farmer. A police investigation quickly leads to two startling disclosures: the newborn's mother is an unmarried Amish woman, eighteen-year-old Katie Fisher. And the infant did not die of natural causes. Although Katie denies the medical proof that she gave birth to the child, circumstantial evidence leads to her arrest for the murder of her baby. One hundred miles away, Philadelphia defense attorney Ellie Hathaway has achieved an enviable, high-profile career. But her latest court victory has set the sands shifting beneath her. Single at thirty-nine and unsatisfied with her relationship, Ellie doesn't look back when she turns down her chance to make partner and takes off for an open-ended stay at her great-aunt's home in Paradise. Fate brings her to Katie Fisher. Suddenly, Ellie sees the chance to defend a client who truly needs her, not just one who can afford her. But taking on this case challenges Ellie in more ways than one. She finds herself not only in a clash of wills with a client who does not want to be defended but also in a clash of cultures with a people whose channels of justice are markedly different from her own. Immersing herself in Katie Fisher's life -- and in a world founded on faith, humility, duty, and honesty -- Ellie begins to understand the pressures and sacrifices of those who to live plain. As she peels away the layers of fact and fantasy, Ellie calls on an old friend for guidance. Now, just as this man from Ellie's past reenters her life, she must uncover the truth about a complex case, a tragic loss, the bonds of love -- and her own deepest fears and desires.","Jodi Picoult has touched readers deeply with her acclaimed novels, such as Keeping Faith and The Pact. Gifted with ""a remarkable ability to make us share her characters' feelings"" (People), Picoult now explores the complex choices of the heart for a young Amish woman -- the compelling journey of discovery for an urban lawyer who befriends and protects her.    The small town of Paradise, Pennsylvania, is a jewel in Lancaster County -- known for its picture-postcard landscapes and bucolic lifestyle. But that peace is shattered by the discovery of a dead infant in the barn of an Amish farmer. A police investigation quickly leads to two startling disclosures: the newborn's mother is an unmarried Amish woman, eighteen-year-old Katie Fisher. And the infant did not die of natural causes. Although Katie denies the medical proof that she gave birth to the child, circumstantial evidence leads to her arrest for the murder of her baby.    One hundred miles away, Philadelphia defense attorney Ellie Hathaway has achieved an enviable, high-profile career. But her latest court ""victory"" has set the sands shifting beneath her. Single at thirty-nine and unsatisfied with her relationship, Ellie doesn't look back when she turns down her chance to make partner and takes off for an open-ended stay at her great-aunt's home in Paradise.    Fate brings her to Katie Fisher. Suddenly, Ellie sees the chance to defend a client who truly needs her, not just one who can afford her. But taking on this case challenges Ellie in more ways than one. She finds herself not only in a clash of wills with a client who does not want to be defended but also in a clash of cultures with a people whose channels of justice are markedly different from her own.    Immersing herself in Katie Fisher's life -- and in a world founded on faith, humility, duty, and honesty -- Ellie begins to understand the pressures and sacrifices of those who to live ""plain."" As she peels away the layers of fact and fantasy, Ellie calls on an old friend for guidance. Now, just as this man from Ellie's past reenters her life, she must uncover the truth about a complex case, a tragic loss, the bonds of love -- and her own deepest fears and desires.    Moving seamlessly from psychological drama to courtroom suspense, Plain Truth is a triumph of contemporary storytelling. Jodi Picoult presents a fascinating portrait of Amish life rarely witnessed by those outside the faith -- and discovers a place where circumstances are not always what they seem, where love meets falsehood, and where relationships grow strong enough to span two worlds."
110,Suite FranÃ§aise,9781400096275,https://www.goodreads.com/buy_buttons/12/follow?book_id=43944&ref=x_gr_w_bb&tag=x_gr_w_bb-20,"The first two stories of a masterwork once thought lost, written by a pre-WWII bestselling author who was deported to Auschwitz and died before her work could be completed.By the early l940s, when Ukrainian-born IrÃ¨ne NÃ©mirovsky began working on what would become Suite FranÃ§aiseâthe first two parts of a planned five-part novelâshe was already a highly successful writer living in Paris. But she was also a Jew, and in 1942 she was arrested and deported to Auschwitz: a month later she was dead at the age of thirty-nine. Two years earlier, living in a small village in central Franceâwhere she, her husband, and their two small daughters had fled in a vain attempt to elude the Nazisâshe'd begun her novel, a luminous portrayal of a human drama in which she herself would become a victim. When she was arrested, she had completed two parts of the epic, the handwritten manuscripts of which were hidden in a suitcase that her daughters would take with them into hiding and eventually into freedom. Sixty-four years later, at long last, we can read NÃ©mirovsky's literary masterpiece The first part, ""A Storm in June,"" opens in the chaos of the massive 1940 exodus from Paris on the eve of the Nazi invasion during which several families and individuals are thrown together under circumstances beyond their control. They share nothing but the harsh demands of survivalâsome trying to maintain lives of privilege, others struggling simply to preserve their livesâbut soon, all together, they will be forced to face the awful exigencies of physical and emotional displacement, and the annihilation of the world they know. In the second part, ""Dolce,"" we enter the increasingly complex life of a German-occupied provincial village. Coexisting uneasily with the soldiers billeted among them, the villagersâfrom aristocrats to shopkeepers to peasantsâcope as best they can. Some choose resistance, others collaboration, and as their community is transformed by these acts, the lives of these these men and women reveal nothing less than the very essence of humanity.Suite FranÃ§aise is a singularly piercing evocationâat once subtle and severe, deeply compassionate and fiercely ironicâof life and death in occupied France, and a brilliant, profoundly moving work of art.","Beginning in Paris on the eve of the Nazi occupation in 1940. Suite Française tells the remarkable story of men and women thrown together in circumstances beyond their control. As Parisians flee the city, human folly surfaces in every imaginable way: a wealthy mother searches for sweets in a town without food; a couple is terrified at the thought of losing their jobs, even as their world begins to fall apart. Moving on to a provincial village now occupied by German soldiers, the locals must learn to coexist with the enemy—in their town, their homes, even in their hearts.When Irène Némirovsky began working on Suite Française, she was already a highly successful writer living in Paris. But she was also a Jew, and in 1942 she was arrested and deported to Auschwitz, where she died. For sixty-four years, this novel remained hidden and unknown."
111,A Short History of Nearly Everything,9780767908184,https://www.goodreads.com/buy_buttons/12/follow?book_id=21&ref=x_gr_w_bb&tag=x_gr_w_bb-20,"In Bryson's biggest book, he confronts his greatest challenge: to understandâand, if possible, answerâthe oldest, biggest questions we have posed about the universe and ourselves. Taking as territory everything from the Big Bang to the rise of civilization, Bryson seeks to understand how we got from there being nothing at all to there being us. To that end, he has attached himself to a host of the worldâs most advanced (and often obsessed) archaeologists, anthropologists, and mathematicians, travelling to their offices, laboratories, and field camps. He has read (or tried to read) their books, pestered them with questions, apprenticed himself to their powerful minds. A Short History of Nearly Everything is the record of this quest, and it is a sometimes profound, sometimes funny, and always supremely clear and entertaining adventure in the realms of human knowledge, as only Bill Bryson can render it. Science has never been more involving or entertaining.",
112,"Gilead (Gilead, #1)",9780312424404,https://www.goodreads.com/buy_buttons/12/follow?book_id=68210&ref=x_gr_w_bb&tag=x_gr_w_bb-20,"Twenty-four years after her first novel, Housekeeping, Marilynne Robinson returns with an intimate tale of three generations from the Civil War to the twentieth century: a story about fathers and sons and the spiritual battles that still rage at America's heart. Writing in the tradition of Emily Dickinson and Walt Whitman, Marilynne Robinson's beautiful, spare, and spiritual prose allows ""even the faithless reader to feel the possibility of transcendent order"" (Slate). In the luminous and unforgettable voice of Congregationalist minister John Ames, Gilead reveals the human condition and the often unbearable beauty of an ordinary life.","The 2004 Pulitzer Prize winning novel A New York Times Top-Ten Book of 2004 Winner of the National Book Critics Circle Award for Fiction  Nearly 25 years after Housekeeping, Marilynne Robinson returns with an intimate tale of three generations, from the Civil War to the 20th century: a story about fathers and sons and the spiritual battles that still rage at America's heart. In the words of Kirkus, it is a novel ""as big as a nation, as quiet as thought, and moving as prayer. Matchless and towering."" Gilead tells the story of America and will break your heart."
113,"The Penultimate Peril (A Series of Unfortunate Events, #12)",9780064410151,https://www.goodreads.com/buy_buttons/12/follow?book_id=65110&ref=x_gr_w_bb&tag=x_gr_w_bb-20,"
  Dear Reader,
If this is the first book you found while searching for a book to read next, then the first thing you should know is that this next-to-last book is what you should put down first. Sadly, this book presents the next-to-last chronicle of the lives of the Baudelaire orphans, and it is next-to-first in its supply of misery, despair, and unpleasantness.Probably the next-to-last thing you would like to read about are a harpoon gun, a rooftop sunbathing alon, two mysterious initials, three unidentified triplets, a notorious villain, and an unsavory curry.Next-to-last things are the first thing to be avoided, and so allow me to recommend that you put this next-to-last book down first, and find something else to read next at last, such a s the next-to-last book in another chronicle, or a chronicle containing other next-to-last things, so that this next-to-last book does not become the last book you will read.
  With all due respect,
Lemony Snicket","NOW A NETFLIX ORIGINAL SERIES  Lemony Snicket returns with the last book before the last book of his bestselling A Series of Unfortunate Events. Scream and run away before the secrets of the series are revealed!  Very little is known about Lemony Snicket and A Series of Unfortunate Events. What we do know is contained in the following brief list:   The books have inexplicably sold millions and millions of copies worldwide  People in more than 40 countries are consumed by consuming Snicket  The movie was as sad as the books, if not more so  Like unrefrigerated butter and fungus, the popularity of these books keeps spreading   Even less is known about book the twelfth in this alarming phenomenon. What we do know is contained in the following brief list:    In this book, things only get worse  Count Olaf is still evil  The Baudelaire orphans do not win a contest  The title begins with the word ‘The’   Sometimes, ignorance is bliss."
114,The Boy in the Striped Pajamas,9780385751063,https://www.goodreads.com/buy_buttons/12/follow?book_id=39999&ref=x_gr_w_bb&tag=x_gr_w_bb-20,"Berlin 1942 When Bruno returns home from school one day, he discovers that his belongings are being packed in crates. His father has received a promotion and the family must move from their home to a new house far far away, where there is no one to play with and nothing to do. A tall fence running alongside stretches as far as the eye can see and cuts him off from the strange people he can see in the distance. But Bruno longs to be an explorer and decides that there must be more to this desolate new place than meets the eye. While exploring his new environment, he meets another boy whose life and circumstances are very different to his own, and their meeting results in a friendship that has devastating consequences.","“Powerful and unsettling. . . . As memorable an introduction to the subject as The Diary of Anne Frank.” —USA Today     Berlin, 1942: When Bruno returns home from school one day, he discovers that his belongings are being packed in crates. His father has received a promotion and the family must move to a new house far, far away, where there is no one to play with and nothing to do. A tall fence stretches as far as the eye can see and cuts him off from the strange people in the distance.     But Bruno longs to be an explorer and decides that there must be more to this desolate new place than meets the eye. While exploring his new environment, he meets another boy whose life and circumstances are very different from his own, and their meeting results in a friendship that has devastating consequences."
115,"The Titan's Curse (Percy Jackson and the Olympians, #3)",9780141382890,https://www.goodreads.com/buy_buttons/12/follow?book_id=561456&ref=x_gr_e_nl_general_sout_bb&tag=x_gr_e_nl_general_sout_bb-20,"It's not everyday you find yourself in combat with a half-lion, half-human.But when you're the son of a Greek god, it happens. And now my friend Annabeth is missing, a goddess is in chains and only five half-blood heroes can join the quest to defeat the doomsday monster.Oh, and guess what? The Oracle has predicted that not all of us will survive...","When Percy Jackson receives an urgent distress call from his friend Grover, he immediately prepares for battle. He knows he’ll need his powerful demigod allies, Annabeth and Thalia, at his side; his trusty bronze sword, Riptide; and . . . a ride from his mom.   The demigods race to the rescue, to find that Grover has made an important  discovery: two new powerful half-bloods whose parentage is unknown. But that’s not all that awaits them. The Titan lord, Kronos, has set up his most devious trap yet, and the young heroes have just fallen prey. Hilarious and action-packed, this third adventure in the series finds Percy faced with his most dangerous challenge so far: the chilling prophecy of the Titan’s curse."
116,The Book of Lost Things,9780743298858,https://www.goodreads.com/buy_buttons/12/follow?book_id=69136&ref=x_gr_e_nl_general_sout_bb&tag=x_gr_e_nl_general_sout_bb-20,"High in his attic bedroom, twelve-year-old David mourns the death of his mother, with only the books on his shelf for company. But those books have begun to whisper to him in the darkness. Angry and alone, he takes refuge in his imagination and soon finds that reality and fantasy have begun to meld. While his family falls apart around him, David is violently propelled into a world that is a strange reflection of his own -- populated by heroes and monsters and ruled by a faded king who keeps his secrets in a mysterious book, The Book of Lost Things.Taking readers on a vivid journey through the loss of innocence into adulthood and beyond, New York Times bestselling author John Connolly tells a dark and compelling tale that reminds us of the enduring power of stories in our lives.","Taking refuge in fairy tales after the loss of his mother, twelve-year-old David finds himself violently propelled into an imaginary land in which the boundaries of fantasy and reality are disturbingly melded. By the author of The Black Angel. 75,000 first printing."
117,"Lamb: The Gospel According to Biff, Christ's Childhood Pal",9780380813810,https://www.goodreads.com/buy_buttons/12/follow?book_id=28881&ref=x_gr_w_bb&tag=x_gr_w_bb-20,"The birth of Jesus has been well chronicled, as have his glorious teachings, acts, and divine sacrifice after his thirtieth birthday. But no one knows about the early life of the Son of God, the missing yearsâexcept Biff, the Messiah's best bud, who has been resurrected to tell the story in the divinely hilarious yet heartfelt work ""reminiscent of Vonnegut and Douglas Adams"" (Philadelphia Inquirer).Verily, the story Biff has to tell is a miraculous one, filled with remarkable journeys, magic, healings, kung fu, corpse reanimations, demons, and hot babes. Even the considerable wiles and devotion of the Savior's pal may not be enough to divert Joshua from his tragic destiny. But there's no one who loves Josh moreâexcept maybe ""Maggie,"" Mary of Magdalaâand Biff isn't about to let his extraordinary pal suffer and ascend without a fight.","The birth of Jesus has been well chronicled, as have his glorious teachings, acts, and divine sacrifice after his thirtieth birthday. But no one knows about the early life of the Son of God, the missing years -- except Biff, the Messiah's best bud, who has been resurrected to tell the story in the divinely hilarious yet heartfelt work ""reminiscent of Vonnegut and Douglas Adams"" (Philadelphia Inquirer).  Verily, the story Biff has to tell is a miraculous one, filled with remarkable journeys, magic, healings, kung fu, corpse reanimations, demons, and hot babes. Even the considerable wiles and devotion of the Savior's pal may not be enough to divert Joshua  from his tragic destiny. But there's no one who loves Josh more -- except maybe ""Maggie,"" Mary of Magdala -- and Biff isn't about to let his extraordinary pal suffer and ascend without a fight."
118,"Graceling (Graceling Realm, #1)",9780152063962,https://www.goodreads.com/buy_buttons/12/follow?book_id=3236307&ref=x_gr_w_bb&tag=x_gr_w_bb-20,"Katsa has been able to kill a man with her bare hands since she was eightâsheâs a Graceling, one of the rare people in her land born with an extreme skill. As niece of the king, she should be able to live a life of privilege, but Graced as she is with killing, she is forced to work as the kingâs thug. She never expects to fall in love with beautiful Prince Po. She never expects to learn the truth behind her Graceâor the terrible secret that lies hidden far away . . . a secret that could destroy all seven kingdoms with words alone. With elegant, evocative prose and a cast of unforgettable characters, debut author Kristin Cashore creates a mesmerizing world, a death-defying adventure, and a heart-racing romance that will consume you, hold you captive, and leave you wanting more.","Discover the Graceling Realm in this unforgettable, award-winning novel from bestselling author Kristin Cashore    A New York Times bestseller ALA Best Book for Young Adults Mythopoeic Fantasy Award for Children's Literature Winner Publishers Weekly, School Library Journal,Booklist, and BCCB Best Book of the Year     “Rageful, exhilarating, wistful in turns"" (The New York Times Book Review) with “a knee weakening romance” (LA Times).  Graceling is a thrilling, action-packed fantasy adventure that will resonate deeply with anyone trying to find their way in the world.    Graceling tells the story of the vulnerable-yet-strong Katsa, who is smart and beautiful and lives in the Seven Kingdoms where selected people are born with a Grace, a special talent that can be anything at all. Katsa’s Grace is killing. As the king’s niece, she is forced to use her extreme skills as his brutal enforcer. Until the day she meets Prince Po, who is Graced with combat skills, and Katsa’s life begins to change. She never expects to become Po’s friend. She never expects to learn a new truth about her own Grace—or about a terrible secret that lies hidden far away . . . a secret that could destroy all seven kingdoms with words alone.   And don’t miss the sequel Fire and companion Bitterblue, both award-winning, New York Times bestsellers, and full of Kristin Cashore’s elegant, evocative prose and unforgettable characters."
119,"Frostbite (Vampire Academy, #2)",9781595141750,https://www.goodreads.com/buy_buttons/15/follow?book_id=2282133&ref=x_gr_w_bb&tag=x_gr_w_bb_ca-20,"Rose loves Dimitri, Dimitri might love Tasha, and Mason would die to be with Rose...Itâs winter break at St. Vladimirâs, but Rose is feeling anything but festive. A massive Strigoi attack has put the school on high alert, and now the Academyâs crawling with Guardiansâincluding Roseâs hard-hitting mother, Janine Hathaway. And if hand-to-hand combat with her mom wasnât bad enough, Roseâs tutor Dimitri has his eye on someone else, her friend Masonâs got a huge crush on her, and Rose keeps getting stuck in Lissaâs head while sheâs making out with her boyfriend, Christian! The Strigoi are closing in, and the Academyâs not taking any risks... This year, St. Vladâs annual holiday ski trip is mandatory.But the glittering winter landscape and the posh Idaho resort only create the illusion of safety. When three friends run away in an offensive move against the deadly Strigoi, Rose must join forces with Christian to rescue them. But heroism rarely comes without a price...","Rose loves Dimitri, Dimitri might love Tasha, and Mason would die to be with Rose… It’s winter break at St. Vladimir’s, but Rose is feeling anything but festive. A massive Strigoi attack has put the school on high alert, and now the Academy’s crawling with Guardians—including Rose’s hard-hitting mother, Janine Hathaway. And if handto- hand combat with her mom wasn’t bad enough, Rose’s tutor Dimitri has his eye on someone else, her friend Mason’s got a huge crush on her, and Rose keeps getting stuck in Lissa’s head while she’s making out with her boyfriend, Christian! The Strigoi are closing in, and the Academy’s not taking any risks.... This year, St. Vlad’s annual holiday ski trip is mandatory.  But the glittering winter landscape and the posh Idaho resort only create the illusion of safety. When three friends run away in an offensive move against the deadly Strigoi, Rose must join forces with Christian to rescue them. But heroism rarely comes without a price…"
