,Book Title,ISBN,Amazon URL,GoodReads Description,Riffle Description
0,"Harry Potter and the Deathly Hallows (Harry Potter, #7)",9780545010221,https://www.goodreads.com/buy_buttons/12/follow?book_id=136251&ref=x_gr_w_bb&tag=x_gr_w_bb-20,"It's no longer safe for Harry at Hogwarts, so he and his best friends, Ron and Hermione, are on the run. Professor Dumbledore has given them clues about what they need to do to defeat the dark wizard, Lord Voldemort, once and for all, but it's up to them to figure out what these hints and suggestions really mean.Their cross-country odyssey has them searching desperately for the answers, while evading capture or death at every turn. At the same time, their friendship, fortitude, and sense of right and wrong are tested in ways they never could have imagined.The ultimate battle between good and evil that closes out this final chapter of the epic series takes place where Harry's Wizarding life began: at Hogwarts. The satisfying conclusion offers shocking last-minute twists, incredible acts of courage, powerful new forms of magic, and the resolution of many mysteries.Above all, this intense, cathartic book serves as a clear statement of the message at the heart of the Harry Potter series: that choice matters much more than destiny, and that love will always triumph over death.","The magnificent final book in J. K. Rowling's seven-part saga comes to readers July 21, 2007.  You'll find out July 21!"
1,"The Hunger Games (The Hunger Games, #1)",9780439023481,https://www.goodreads.com/buy_buttons/12/follow?book_id=2767052&ref=x_gr_w_bb&tag=x_gr_w_bb-20,"Winning will make you famous. Losing means certain death.The nation of Panem, formed from a post-apocalyptic North America, is a country that consists of a wealthy Capitol region surrounded by 12 poorer districts. Early in its history, a rebellion led by a 13th district against the Capitol resulted in its destruction and the creation of an annual televised event known as the Hunger Games. In punishment, and as a reminder of the power and grace of the Capitol, each district must yield one boy and one girl between the ages of 12 and 18 through a lottery system to participate in the games. The 'tributes' are chosen during the annual Reaping and are forced to fight to the death, leaving only one survivor to claim victory.When 16-year-old Katniss's young sister, Prim, is selected as District 12's female representative, Katniss volunteers to take her place. She and her male counterpart Peeta, are pitted against bigger, stronger representatives, some of whom have trained for this their whole lives. , she sees it as a death sentence. But Katniss has been close to death before. For her, survival is second nature.","The book no one can stop talking about . . .  In the ruins of a place once known as North America lies the nation of Panem, a shining Capitol surrounded by twelve outlying districts. The Capitol is harsh and cruel and keeps the districts in line by forcing them all to send one boy and one girl between the ages of twelve and eighteen to participate in the annual Hunger Games, a fight to the death on live TV. Sixteen-year-old Katniss Everdeen, who lives alone with her mother and younger sister, regards it as a death sentence when she is forced to represent her district in the Games. But Katniss has been close to dead and survival, for her, is second nature. Without really meaning to, she becomes a contender. But if she is to win, she will have to start making choices that weigh survival against humanity and life against love.   New York Times bestselling author Suzanne Collins delivers equal parts suspense and philosophy, adventure and romance, in this searing novel set in a future with unsettling parallels to our present."
2,"Harry Potter and the Half-Blood Prince (Harry Potter, #6)",9780439785969,https://www.goodreads.com/buy_buttons/12/follow?book_id=1&ref=x_gr_w_bb&tag=x_gr_w_bb-20,"When Harry Potter and the Half-Blood Prince opens, the war against Voldemort has begun. The Wizarding world has split down the middle, and as the casualties mount, the effects even spill over onto the Muggles. Dumbledore is away from Hogwarts for long periods, and the Order of the Phoenix has suffered grievous losses. And yet, as in all wars, life goes on.Harry, Ron, and Hermione, having passed their O.W.L. level exams, start on their specialist N.E.W.T. courses. Sixth-year students learn to Apparate, losing a few eyebrows in the process. Teenagers flirt and fight and fall in love. Harry becomes captain of the Gryffindor Quidditch team, while Draco Malfoy pursues his own dark ends. And classes are as fascinating and confounding as ever, as Harry receives some extraordinary help in Potions from the mysterious Half-Blood Prince.Most importantly, Dumbledore and Harry work together to uncover the full and complex story of a boy once named Tom Riddleâthe boy who became Lord Voldemort. Like Harry, he was the son of one Muggle-born and one Wizarding parent, raised unloved, and a speaker of Parseltongue. But the similarities end there, as the teenaged Riddle became deeply interested in the Dark objects known as Horcruxes: objects in which a wizard can hide part of his soul, if he dares splinter that soul through murder.Harry must use all the tools at his disposal to draw a final secret out of one of Riddleâs teachers, the sly Potions professor Horace Slughorn. Finally Harry and Dumbledore hold the key to the Dark Lordâs weaknesses... until a shocking reversal exposes Dumbledoreâs own vulnerabilities, and casts Harryâsâand Hogwartsâsâfuture in shadow.Source: http://harrypotter.scholastic.com","The war against Voldemort is not going well; even the Muggles have been affected. Dumbledore is absent from Hogwarts for long stretches of time, and the Order of the Phoenix has already suffered losses.   And yet . . . as with all wars, life goes on. Sixth-year students learn to Apparate. Teenagers flirt and fight and fall in love. Harry receives some extraordinary help in Potions from the mysterious Half-Blood Prince. And with Dumbledore's guidance, he seeks out the full, complex story of the boy who became Lord Voldemort -- and thus finds what may be his only vulnerability."
3,"Harry Potter and the Goblet of Fire (Harry Potter, #4)",9780439139601,https://www.goodreads.com/buy_buttons/12/follow?book_id=6&ref=x_gr_w_bb&tag=x_gr_w_bb-20,"Harry Potter and the Goblet of Fire is the fourth novel in the Harry Potter series, written by British author J. K. Rowling. It follows Harry Potter, a wizard in his fourth year at Hogwarts School of Witchcraft and Wizardry and the mystery surrounding the entry of Harry's name into the Triwizard Tournament, in which he is forced to compete. The book was published in the United Kingdom by Bloomsbury and in the United States by Scholastic, in both countries the release date was 8 July 2000, the first time a book in the series was published in both countries at the same time. The novel won a Hugo Award, the only Harry Potter novel to do so, in 2001. The book was made into a film, which was released worldwide on 18 November 2005, and a video game by Electronic Arts","The paperback edition of the legendary, record-breaking, best-selling fourth Harry Potter novel.  Harry Potter is midway through his training as a wizard and his coming of age. Harry wants to get away from the pernicious Dursleys and go to the International Quidditch Cup. He wants to find out about the mysterious event that's supposed to take place at Hogwarts this year, an event involving two other rival schools of magic, and a competition that hasn't happened for a hundred years. He wants to be a normal, fourteen-year-old wizard. But unfortunately for Harry Potter, he's not normal - even by wizarding standards. And in his case, different can be deadly."
4,"Harry Potter and the Order of the Phoenix (Harry Potter, #5)",9780439358071,https://www.goodreads.com/buy_buttons/14/follow?book_id=2&ref=x_gr_w_bb&tag=x_gr_w_bb-20,"Harry Potter and the Order of the Phoenix is the fifth novel in the Harry Potter series, written by J. K. Rowling. It follows Harry Potter's struggles through his fifth year at Hogwarts School of Witchcraft and Wizardry, including the surreptitious return of the antagonist Lord Voldemort, O.W.L. exams, and an obstructive Ministry of Magic. The novel was published on 21 June 2003 by Bloomsbury in the United Kingdom, Scholastic in the United States, and Raincoast in Canada. Five million copies were sold in the first 24 hours of publication.[2] It is the longest book of the series. Harry Potter and the Order of the Phoenix has won several awards, including being named an American Library Association Best Book for Young Adults in 2003. The book has also been made into a film, which was released in 2007, and into a video game by Electronic Arts.","""'You are sharing the Dark Lord's thoughts and emotions. The Headmaster thinks it inadvisable for this to continue. He wishes me to teach you how to close your mind to the Dark Lord.'""  Dark times have come to Hogwarts. After the Dementors' attack on his cousin Dudley, Harry Potter knows that Voldemort will stop at nothing to find him. There are many who deny the Dark Lord's return, but Harry is not alone: a secret order gathers at Grimmauld Place to fight against the Dark forces. Harry must allow Professor Snape to teach him how to protect himself from Voldemort's savage assaults on his mind. But they are growing stronger by the day and Harry is running out of time ...  Harry Potter and the Order of the Phoenix is currently the featured read in Pottermore’s Wizarding World Book Club. Sign up and join weekly Twitter discussions at WW Book Club."
5,The Book Thief,9780375831003,https://www.goodreads.com/buy_buttons/12/follow?book_id=19063&ref=x_gr_w_bb&tag=x_gr_w_bb-20,"Winner of the 2007 BookBrowse Ruby Award. Itâs just a small story really, about among other things: a girl, some words, an accordionist, some fanatical Germans, a Jewish fist-fighter, and quite a lot of thievery ...Set during World War II in Germany, Markus Zusakâs groundbreaking new novel is the story of Liesel Meminger, a foster girl living outside of Munich. Liesel scratches out a meager existence for herself by stealing when she encounters something she canât resist â books. With the help of her accordion-playing foster father, she learns to read and shares her stolen books with her neighbors during bombing raids as well as with the Jewish man hidden in her basement before he is marched to Dachau. This is an unforgettable story about the ability of books to feed the soul.","The extraordinary #1 New York Times bestseller that is now a major motion picture, Markus Zusak's unforgettable story is about the ability of books to feed the soul.  It is 1939. Nazi Germany. The country is holding its breath. Death has never been busier, and will become busier still.  Liesel Meminger is a foster girl living outside of Munich, who scratches out a meager existence for herself by stealing when she encounters something she can’t resist–books. With the help of her accordion-playing foster father, she learns to read and shares her stolen books with her neighbors during bombing raids as well as with the Jewish man hidden in her basement.   In superbly crafted writing that burns with intensity, award-winning author Markus Zusak, author of I Am the Messenger, has given us one of the most enduring stories of our time."
6,The Time Traveler's Wife,9781939126016,https://www.goodreads.com/buy_buttons/12/follow?book_id=18619684&ref=x_gr_w_bb&tag=x_gr_w_bb-20,"A funny, often poignant tale of boy meets girl with a twist: what if one of them couldn't stop slipping in and out of time? Highly original and imaginative, this debut novel raises questions about life, love, and the effects of time on relationships.Audrey Niffeneggerâs innovative debut, The Time Travelerâs Wife, is the story of Clare, a beautiful art student, and Henry, an adventuresome librarian, who have known each other since Clare was six and Henry was thirty-six, and were married when Clare was twenty-three and Henry thirty-one. Impossible but true, because Henry is one of the first people diagnosed with Chrono-Displacement Disorder: periodically his genetic clock resets and he finds himself misplaced in time, pulled to moments of emotional gravity in his life, past and future. His disappearances are spontaneous, his experiences unpredictable, alternately harrowing and amusing. The Time Travelerâs Wife depicts the effects of time travel on Henry and Clareâs marriage and their passionate love for each other as the story unfolds from both points of view. Clare and Henry attempt to live normal lives, pursuing familiar goalsâsteady jobs, good friends, children of their own. All of this is threatened by something they can neither prevent nor control, making their story intensely moving and entirely unforgettable.","Audrey Niffenegger's innovative debut, The Time Traveler's Wife, is the story of Clare, a beautiful art student, and Henry, an adventuresome librarian, who have known each other since Clare was six and Henry was thirty-six, and were married when Clare was twenty-three and Henry thirty-one. Impossible but true, because Henry is one of the first people diagnosed with Chrono-Displacement Disorder: periodically his genetic clock resets and he finds himself misplaced in time, pulled to moments of emotional gravity in his life, past and future. His disappearances are spontaneous, his experiences unpredictable, alternately harrowing and amusing.  The Time Traveler's Wife depicts the effects of time travel on Henry and Clare's marriage and their passionate love for each other as the story unfolds from both points of view. Clare and Henry attempt to live normal lives, pursuing familiar goals--steady jobs, good friends, children of their own. All of this is threatened by something they can neither prevent nor control, making their story intensely moving and entirely unforgettable."
7,The Kite Runner,9781594480003,https://www.goodreads.com/buy_buttons/12/follow?book_id=77203&ref=x_gr_w_bb&tag=x_gr_w_bb-20," âIt may be unfair, but what happens in a few days, sometimes even a single day, can change the course of a whole lifetime."" Amir is the son of a wealthy Kabul merchant, a member of the ruling caste of Pashtuns. Hassan, his servant and constant companion, is a Hazara, a despised and impoverished caste. Their uncommon bond is torn by Amir's choice to abandon his friend amidst the increasing ethnic, religious, and political tensions of the dying years of the Afghan monarchy, wrenching them far apart. But so strong is the bond between the two boys that Amir journeys back to a distant world, to try to right past wrongs against the only true friend he ever had.The unforgettable, heartbreaking story of the unlikely friendship between a wealthy boy and the son of his fatherâs servant, The Kite Runner is a beautifully crafted novel set in a country that is in the process of being destroyed. It is about the power of reading, the price of betrayal, and the possibility of redemption; and an exploration of the power of fathers over sonsâtheir love, their sacrifices, their lies.A sweeping story of family, love, and friendship told against the devastating backdrop of the history of Afghanistan over the last thirty years, The Kite Runner is an unusual and powerful novel that has become a beloved, one-of-a-kind classic.","The #1 New York Times bestselling debut novel that introduced Khaled Hosseini to millions of readers the world over.     The unforgettable, heartbreaking story of the unlikely friendship between a wealthy boy and the son of his father’s servant, caught in the tragic sweep of history, The Kite Runner transports readers to Afghanistan at a tense and crucial moment of change and destruction. A powerful story of friendship, it is also about the power of reading, the price of betrayal, and the possibility of redemption; and an exploration of the power of fathers over sons—their love, their sacrifices, their lies.     Since its publication in 2003 Kite Runner has become a beloved, one-of-a-kind classic of contemporary literature, touching millions of readers, and launching the career of one of America's most treasured writers."
8,The Help,9780399155345,https://www.goodreads.com/buy_buttons/12/follow?book_id=4667024&ref=x_gr_w_bb&tag=x_gr_w_bb-20,"Be prepared to meet three unforgettable women:Twenty-two-year-old Skeeter has just returned home after graduating from Ole Miss. She may have a degree, but it is 1962, Mississippi, and her mother will not be happy till Skeeter has a ring on her finger. Skeeter would normally find solace with her beloved maid Constantine, the woman who raised her, but Constantine has disappeared and no one will tell Skeeter where she has gone.Aibileen is a black maid, a wise, regal woman raising her seventeenth white child. Something has shifted inside her after the loss of her own son, who died while his bosses looked the other way. She is devoted to the little girl she looks after, though she knows both their hearts may be broken.Minny, Aibileenâs best friend, is short, fat, and perhaps the sassiest woman in Mississippi. She can cook like nobodyâs business, but she canât mind her tongue, so sheâs lost yet another job. Minny finally finds a position working for someone too new to town to know her reputation. But her new boss has secrets of her own.Seemingly as different from one another as can be, these women will nonetheless come together for a clandestine project that will put them all at risk. And why? Because they are suffocating within the lines that define their town and their times. And sometimes lines are made to be crossed.In pitch-perfect voices, Kathryn Stockett creates three extraordinary women whose determination to start a movement of their own forever changes a town, and the way women â mothers, daughters, caregivers, friends â view one another. A deeply moving novel filled with poignancy, humor, and hope, The Help is a timeless and universal story about the lines we abide by, and the ones we don't.","Three ordinary women are about to take one extraordinary step.   Twenty-two-year-old Skeeter has just returned home after graduating from Ole Miss. She may have a degree, but it is 1962, Mississippi, and her mother will not be happy till Skeeter has a ring on her finger. Skeeter would normally find solace with her beloved maid Constantine, the woman who raised her, but Constantine has disappeared and no one will tell Skeeter where she has gone.   Aibileen is a black maid, a wise, regal woman raising her seventeenth white child. Something has shifted inside her after the loss of her own son, who died while his bosses looked the other way. She is devoted to the little girl she looks after, though she knows both their hearts may be broken.   Minny, Aibileen’s best friend, is short, fat, and perhaps the sassiest woman in Mississippi. She can cook like nobody’s business, but she can’t mind her tongue, so she’s lost yet another job. Minny finally finds a position working for someone too new to town to know her reputation. But her new boss has secrets of her own.   Seemingly as different from one another as can be, these women will nonetheless come together for a clandestine project that will put them all at risk. And why? Because they are suffocating within the lines that define their town and their times. And sometimes lines are made to be crossed.   In pitch-perfect voices, Kathryn Stockett creates three extraordinary women whose determination to start a movement of their own forever changes a town, and the way women—mothers, daughters, caregivers, friends—view one another. A deeply moving novel filled with poignancy, humor, and hope, The Help is a timeless and universal story about the lines we abide by, and the ones we don’t."
9,A Thousand Splendid Suns,9781594489501,https://www.goodreads.com/buy_buttons/12/follow?book_id=128029&ref=x_gr_w_bb&tag=x_gr_w_bb-20,"At once an incredible chronicle of thirty years of Afghan history and a deeply moving story of family, friendship, faith, and the salvation to be found in love.Propelled by the same superb instinct for storytelling that made The Kite Runner a beloved classic, A Thousand Splendid Suns is at once an incredible chronicle of thirty years of Afghan history, and a deeply moving story of family, friendship, faith, and the salvation to be found in love. Born a generation apart and with very different ideas about love and family, Mariam and Laila are two women brought jarringly together by war, by loss and by fate. As they endure the ever escalating dangers around themâin their home as well as in the streets of Kabulâthey come to form a bond that makes them both sisters and mother-daughter to each other, and that will ultimately alter the course not just of their own lives but of the next generation. With heart-wrenching power and suspense, Hosseini shows how a woman's love for her family can move her to shocking and heroic acts of self-sacrifice, and that in the end it is loveâor even the memory of loveâthat is often the key to survival.","Propelled by the same superb instinct for storytelling that made The Kite Runner a beloved classic, A Thousand Splendid Suns is at once an incredible chronicle of thirty years of Afghan history and a deeply moving story of family, friendship, faith, and the salvation to be found in love.   After 103 weeks on the New York Times bestseller list and with four million copies ofThe Kite Runner shipped, Khaled Hosseini returns with a beautiful, riveting, and haunting novel that confirms his place as one of the most important literary writers today.   Born a generation apart and with very different ideas about love and family, Mariam and Laila are two women brought jarringly together by war, by loss and by fate. As they endure the ever escalating dangers around them-in their home as well as in the streets of Kabul-they come to form a bond that makes them both sisters and mother-daughter to each other, and that will ultimately alter the course not just of their own lives but of the next generation. With heart-wrenching power and suspense, Hosseini shows how a woman's love for her family can move her to shocking and heroic acts of self-sacrifice, and that in the end it is love, or even the memory of love, that is often the key to survival.  A stunning accomplishment, A Thousand Splendid Suns is a haunting, heartbreaking, compelling story of an unforgiving time, an unlikely friendship, and an indestructible love."
10,"Catching Fire (The Hunger Games, #2)",9780439023498,https://www.goodreads.com/buy_buttons/12/follow?book_id=6148028&ref=x_gr_w_bb&tag=x_gr_w_bb-20,"Sparks are igniting.Flames are spreading.And the Capitol wants revenge.Against all odds, Katniss has won the Hunger Games. She and fellow District 12 tribute Peeta Mellark are miraculously still alive. Katniss should be relieved, happy even. After all, she has returned to her family and her longtime friend, Gale. Yet nothing is the way Katniss wishes it to be. Gale holds her at an icy distance. Peeta has turned his back on her completely. And there are whispers of a rebellion against the Capitol - a rebellion that Katniss and Peeta may have helped create.Much to her shock, Katniss has fueled an unrest she's afraid she cannot stop. And what scares her even more is that she's not entirely convinced she should try. As time draws near for Katniss and Peeta to visit the districts on the Capitol's cruel Victory Tour, the stakes are higher than ever. If they can't prove, without a shadow of a doubt, that they are lost in their love for each other, the consequences will be horrifying.In Catching Fire, the second novel in the Hunger Games trilogy, Suzanne Collins continues the story of Katniss Everdeen, testing her more than ever before...and surprising readers at every turn.","Against all odds, Katniss Everdeen has won the annual Hunger Games with fellow district tribute Peeta Mellark. But it was a victory won by defiance of the Capitol and their harsh rules. Katniss and Peeta should be happy. After all, they have just won for themselves and their families a life of safety and plenty. But there are rumors of rebellion among the subjects, and Katniss and Peeta, to their horror, are the faces of that rebellion. The Capitol is angry. The Capitol wants revenge."
