,Book Title,ISBN,Amazon URL,GoodReads Description,Riffle Description
298,"In the Garden of Beasts: Love, Terror, and an American Family in Hitler's Berlin",9780307408846,https://www.goodreads.com/buy_buttons/12/follow?book_id=9938498&ref=x_gr_w_bb&tag=x_gr_w_bb-20,"The time is 1933, the place, Berlin, when William E. Dodd becomes America's first ambassador to Hitler's Germany in a year that proved to be a turning point in history.A mild-mannered professor from Chicago, Dodd brings along his wife, son, and flamboyant daughter, Martha. At first Martha is entranced by the parties and pomp, and the handsome young men of the Third Reich with their infectious enthusiasm for restoring Germany to a position of world prominence. Enamored of the New Germany, she has one affair after another, including with the surprisingly honorable first chief of the Gestapo, Rudolf Diels. But as evidence of Jewish persecution mounts, confirmed by chilling first-person testimony, her father telegraphs his concerns to a largely indifferent State Department back home. Dodd watches with alarm as Jews are attacked, the press is censored, and drafts of frightening new laws begin to circulate. As that first year unfolds and the shadows deepen, the Dodds experience days full of excitement, intrigue, romance and ultimately, horror, when a climactic spasm of violence and murder reveals Hitler's true character and ruthless ambition.Suffused with the tense atmosphere of the period, and with unforgettable portraits of the bizarre Goring and the expectedly charmingâyet wholly sinisterâGoebbels, In the Garden of Beasts lends a stunning, eyewitness perspective on events as they unfold in real time, revealing an era of surprising nuance and complexity. The result is a dazzling, addictively readable work that speaks volumes about why the world did not recognize the grave threat posed by Hitler until Berlin, and Europe, were awash in blood and terror.","Erik Larson has been widely acclaimed as a master of narrative non-fiction, and in his new book, the bestselling author of Devil in the White City turns his hand to a remarkable story set during Hitler’s rise to power.   The time is 1933, the place, Berlin, when William E. Dodd becomes America’s first ambassador to Hitler’s Germany in a year that proved to be a turning point in history.   A mild-mannered professor from Chicago, Dodd brings along his wife, son, and flamboyant daughter, Martha. At first Martha is entranced by the parties and pomp, and the handsome young men of the Third Reich with their infectious enthusiasm for restoring Germany to a position of world prominence. Enamored of the “New Germany,” she has one affair after another, including with the suprisingly honorable first chief of the Gestapo, Rudolf Diels. But as evidence of Jewish persecution mounts, confirmed by chilling first-person testimony, her father telegraphs his concerns to a largely indifferent State Department back home. Dodd watches with alarm as Jews are attacked, the press is censored, and drafts of frightening new laws begin to circulate. As that first year unfolds and the shadows deepen, the Dodds experience days full of excitement, intrigue, romance--and ultimately, horror, when a climactic spasm of violence and murder reveals Hitler’s true character and ruthless ambition.   Suffused with the tense atmosphere of the period, and with unforgettable portraits of the bizarre Göring and the expectedly charming--yet wholly sinister--Goebbels, In the Garden of Beasts lends a stunning, eyewitness perspective on events as they unfold in real time, revealing an era of surprising nuance and complexity. The result is a dazzling, addictively readable work that speaks volumes about why the world did not recognize the grave threat posed by Hitler until Berlin, and Europe, were awash in blood and terror.   “Larson is a marvelous writer...superb at creating characters with a few short strokes.”—New York Times Book Review"
299,"Torment (Fallen, #2)",9780385739146,https://www.goodreads.com/buy_buttons/12/follow?book_id=7740152&ref=x_gr_w_bb&tag=x_gr_w_bb-20,"How many lives do you need to live before you find someone worth dying for?In the aftermath of what happened at Sword & Cross, Luce has been hidden away by her cursed angelic boyfriend, Daniel, in a new school filled with Nephilim, the offspring of fallen angels and humans. Daniel promises she will be safe here, protected from those who would kill her. At the school Luce discovers what the Shadows that have followed her all her life mean â and how to manipulate them to see into her other lives. Yet the more Luce learns about herself, the more she realizes that the past is her only key to unlocking her future . . . and that Daniel hasn't told her everything. What if his version of the past isn't actually the way things happened . . . what if Luce was really meant to be with someone else?The second novel in the addictive FALLEN series...where love never dies.","The second novel in the addictive and worldwide bestselling FALLEN series . . . where love never dies.  #1 New York Times bestseller  A USA Today Bestseller More than 3 million series copies in print!  Hell on earth.  That’s what it’s like for Luce to be apart from her fallen angel boyfriend, Daniel. It took them an eternity to find one another, but now he has told her he must go away. Just long enough to hunt down the Outcasts—immortals who want to kill Luce. Daniel hides Luce at Shoreline, a school on the rocky California coast with unusually gifted students: Nephilim, the offspring of fallen angels and humans.  At Shoreline, Luce learns what the Shadows are, and how she can use them as windows to her previous lives. Yet the more Luce learns, the more she suspects that Daniel hasn’t told her everything. He’s hiding something—something dangerous. What if Daniel’s version of the past isn’t actually true? What if Luce is really meant to be with someone else?  And don't miss FALLEN on the big screen! The first book in the worldwide bestselling FALLEN series is now a motion picture -- currently available for streaming and releasing in theaters September 8th, 2017.   “Sexy and fascinating and scary . . . I loved loved loved it!” —P. C. Cast, New York Times bestselling author on Fallen"
300,Major Pettigrew's Last Stand,9781400068937,https://www.goodreads.com/buy_buttons/12/follow?book_id=6643090&ref=x_gr_w_bb&tag=x_gr_w_bb-20,"You are about to travel to Edgecombe St. Mary, a small village in the English countryside filled with rolling hills, thatched cottages, and a cast of characters both hilariously original and as familiar as the members of your own family. Among them is Major Ernest Pettigrew (retired), the unlikely hero of Helen Simonson's wondrous debut. Wry, courtly, opinionated, and completely endearing, Major Pettigrew is one of the most indelible characters in contemporary fiction, and from the very first page of this remarkable novel he will steal your heart.The Major leads a quiet life valuing the proper things that Englishmen have lived by for generations: honor, duty, decorum, and a properly brewed cup of tea. But then his brother's death sparks an unexpected friendship with Mrs. Jasmina Ali, the Pakistani shopkeeper from the village. Drawn together by their shared love of literature and the loss of their respective spouses, the Major and Mrs. Ali soon find their friendship blossoming into something more. But village society insists on embracing him as the quintessential local and her as the permanent foreigner. Can their relationship survive the risks one takes when pursuing happiness in the face of culture and tradition?","BONUS: This edition contains a Major Pettigrew's Last Stand discussion guide.  You are about to travel to Edgecombe St. Mary, a small village in the English countryside filled with rolling hills, thatched cottages, and a cast of characters both hilariously original and as familiar as the members of your own family. Among them is Major Ernest Pettigrew (retired), the unlikely hero of Helen Simonson's wondrous debut. Wry, courtly, opinionated, and completely endearing, Major Pettigrew is one of the most indelible characters in contemporary fiction, and from the very first page of this remarkable novel he will steal your heart.   The Major leads a quiet life valuing the proper things that Englishmen have lived by for generations: honor, duty, decorum, and a properly brewed cup of tea. But then his brother's death sparks an unexpected friendship with Mrs. Jasmina Ali, the Pakistani shopkeeper from the village. Drawn together by their shared love of literature and the loss of their respective spouses, the Major and Mrs. Ali soon find their friendship blossoming into something more. But village society insists on embracing him as the quintessential local and her as the permanent foreigner. Can their relationship survive the risks one takes when pursuing happiness in the face of culture and tradition?"
301,"Unearthly (Unearthly, #1)",9780061996160,https://www.goodreads.com/buy_buttons/12/follow?book_id=7488244&ref=x_gr_w_bb&tag=x_gr_w_bb-20,"In the beginning, there's a boy standing in the trees...Clara Gardner has recently learned that she's part angel. Having angel blood run through her veins not only makes her smarter, stronger, and faster than humans (a word, she realizes, that no longer applies to her), but it means she has a purpose, something she was put on this earth to do. Figuring out what that is, though, isn't easy.Her visions of a raging forest fire and an alluring stranger lead her to a new school in a new town. When she meets Christian, who turns out to be the boy of her dreams (literally), everything seems to fall into place and out of place at the same time. Because there's another guy, Tucker, who appeals to Clara's less angelic side.As Clara tries to find her way in a world she no longer understands, she encounters unseen dangers and choices she never thought she'd have to make between honesty and deceit, love and duty, good and evil. When the fire from her vision finally ignites, will Clara be ready to face her destiny?Unearthly is a moving tale of love and fate, and the struggle between following the rules and following your heart.","In the beginning, there's a boy standing in the trees . . . .   Clara Gardner has recently learned that she's part angel. Having angel blood run through her veins not only makes her smarter, stronger, and faster than humans (a word, she realizes, that no longer applies to her), but it means she has a purpose, something she was put on this earth to do. Figuring out what that is, though, isn't easy.   Her visions of a raging forest fire and an alluring stranger lead her to a new school in a new town. When she meets Christian, who turns out to be the boy of her dreams (literally), everything seems to fall into place—and out of place at the same time. Because there's another guy, Tucker, who appeals to Clara's less angelic side.  As Clara tries to find her way in a world she no longer understands, she encounters unseen dangers and choices she never thought she'd have to make—between honesty and deceit, love and duty, good and evil. When the fire from her vision finally ignites, will Clara be ready to face her destiny?  Unearthly is a moving tale of love and fate, and the struggle between following the rules and following your heart."
302,Americanah,9780307271082,https://www.goodreads.com/buy_buttons/12/follow?book_id=15796700&ref=x_gr_w_bb&tag=x_gr_w_bb-20,"From the award-winning author of Half of a Yellow Sun, a powerful story of love, race and identity.As teenagers in Lagos, Ifemelu and Obinze fall in love. Their Nigeria is under military dictatorship, and people are fleeing the country if they can. The self-assured Ifemelu departs for America. There she suffers defeats and triumphs, finds and loses relationships, all the while feeling the weight of something she never thought of back home: race. Obinze had hoped to join her, but post-9/11 America will not let him in, and he plunges into a dangerous, undocumented life in London.Thirteen years later, Obinze is a wealthy man in a newly democratic Nigeria, while Ifemelu has achieved success as a blogger. But after so long apart and so many changes, will they find the courage to meet again, face to face?Fearless, gripping, spanning three continents and numerous lives, Americanah is a richly told story of love and expectation set in todayâs globalized world.","One of The New York Times Book Review's Ten Best Books of the Year  LONGLISTED 2015  – International IMPAC Dublin Literary Award   From the award-winning author of Half of a Yellow Sun, a dazzling new novel: a story of love and race centered around a young man and woman from Nigeria who face difficult choices and challenges in the countries they come to call home.  As teenagers in a Lagos secondary school, Ifemelu and Obinze fall in love. Their Nigeria is under military dictatorship, and people are leaving the country if they can. Ifemelu—beautiful, self-assured—departs for America to study. She suffers defeats and triumphs, finds and loses relationships and friendships, all the while feeling the weight of something she never thought of back home: race. Obinze—the quiet, thoughtful son of a professor—had hoped to join her, but post-9/11 America will not let him in, and he plunges into a dangerous, undocumented life in London.   Years later, Obinze is a wealthy man in a newly democratic Nigeria, while Ifemelu has achieved success as a writer of an eye-opening blog about race in America. But when Ifemelu returns to Nigeria, and she and Obinze reignite their shared passion—for their homeland and for each other—they will face the toughest decisions of their lives.  Fearless, gripping, at once darkly funny and tender, spanning three continents and numerous lives, Americanah is a richly told story set in today’s globalized world: Chimamanda Ngozi Adichie’s most powerful and astonishing novel yet."
303,Defending Jacob,9780385344227,https://www.goodreads.com/buy_buttons/12/follow?book_id=11367726&ref=x_gr_w_bb&tag=x_gr_w_bb-20,"Award-winning author William Landay has written the consummate novel of an embattled family in crisis - a suspenseful, character-driven mystery that is also a spellbinding tale of guilt, betrayal, and the terrifying speed at which our lives can spin out of control.Andy Barber has been an assistant district attorney in his suburban Massachusetts county for more than twenty years. He is respected in his community, tenacious in the courtroom, and happy at home with his wife, Laurie, and son, Jacob. But when a shocking crime shatters their New England town, Andy is blindsided by what happens next: His fourteen-year-old son is charged with the murder of a fellow student. Every parental instinct Andy has rallies to protect his boy. Jacob insists that he is innocent, and Andy believes him. Andy must. He's his father. But as damning facts and shocking revelations surface, as a marriage threatens to crumble and the trial intensifies, as the crisis reveals how little a father knows about his son, Andy will face a trial of his own - between loyalty and justice, between truth and allegation, between a past he's tried to bury and a future he cannot conceive. Award-winning author William Landay has written the consummate novel of an embattled family in crisis - a suspenseful, character-driven mystery that is also a spellbinding tale of guilt, betrayal, and the terrifying speed at which our lives can spin out of control.","NAMED ONE OF THE BEST BOOKS OF THE YEAR BY  Entertainment Weekly • The Boston Globe • Kansas City Star     “A legal thriller that’s comparable to classics such as Scott Turow’s Presumed Innocent . . . Tragic and shocking, Defending Jacob is sure to generate buzz.”—Associated Press     NEW YORK TIMES BESTSELLER  Andy Barber has been an assistant district attorney in his suburban Massachusetts county for more than twenty years. He is respected in his community, tenacious in the courtroom, and happy at home with his wife, Laurie, and son, Jacob. But when a shocking crime shatters their New England town, Andy is blindsided by what happens next: His fourteen-year-old son is charged with the murder of a fellow student.  Every parental instinct Andy has rallies to protect his boy. Jacob insists that he is innocent, and Andy believes him. Andy must. He’s his father. But as damning facts and shocking revelations surface, as a marriage threatens to crumble and the trial intensifies, as the crisis reveals how little a father knows about his son, Andy will face a trial of his own—between loyalty and justice, between truth and allegation, between a past he’s tried to bury and a future he cannot conceive.  Award-winning author William Landay has written the consummate novel of an embattled family in crisis—a suspenseful, character-driven mystery that is also a spellbinding tale of guilt, betrayal, and the terrifying speed at which our lives can spin out of control.  Praise for Defending Jacob     “Ingenious . . . Nothing is predictable. All bets are off.”—The New York Times     “Stunning . . . a novel that comes to you out of the blue and manages to keep you reading feverishly until the whole thing is completed.”—The Huffington Post     “Gripping, emotional murder saga . . . The shocking ending will have readers pulling up their bedcovers to ward off the haunting chill.”—People     “The hype is justified. . . . Exceptionally serious, suspenseful, engrossing.”—The Washington Post     “Even with unexpected twists and turns, the two narratives interlock like the teeth of a zipper, building to a tough and unflinching finale. This novel has major motion picture written all over it.”—The Boston Globe     “Yes, this book came out in January. No, we are not done talking about it.”—Entertainment Weekly"
304,The Thousand Autumns of Jacob de Zoet,9781400065455,https://www.goodreads.com/buy_buttons/12/follow?book_id=7141642&ref=x_gr_w_bb&tag=x_gr_w_bb-20,"In 1799, Jacob de Zoet disembarks on the tiny island of Dejima, the Dutch East India Companyâs remotest trading post in a Japan otherwise closed to the outside world. A junior clerk, his task is to uncover evidence of the previous Chief Residentâs corruption.Cold-shouldered by his compatriots, Jacob earns the trust of a local interpreter and, more dangerously, becomes intrigued by a rare womanâa midwife permitted to study on Dejima under the company physician. He cannot foresee how disastrously each will be betrayed by someone they trust, nor how intertwined and far-reaching the consequences.Duplicity and integrity, love and lust, guilt and faith, cold murder and strange immortality stalk the stage in this enthralling novel, which brings to vivid life the ordinaryâand extraordinaryâpeople caught up in a tectonic shift between East and West.","By the New York Times bestselling author of The Bone Clocks and Cloud Atlas | Longlisted for the Man Booker Prize  In 2007, Time magazine named him one of the most influential novelists in the world. He has twice been short-listed for the Man Booker Prize. The New York Times Book Review called him simply “a genius.” Now David Mitchell lends fresh credence to The Guardian’s claim that “each of his books seems entirely different from that which preceded it.” The Thousand Autumns of Jacob de Zoet is a stunning departure for this brilliant, restless, and wildly ambitious author, a giant leap forward by even his own high standards. A bold and epic novel of a rarely visited point in history, it is a work as exquisitely rendered as it is irresistibly readable.  The year is 1799, the place Dejima in Nagasaki Harbor, the “high-walled, fan-shaped artificial island” that is the Japanese Empire’s single port and sole window onto the world, designed to keep the West at bay; the farthest outpost of the war-ravaged Dutch East Indies Company; and a de facto prison for the dozen foreigners permitted to live and work there. To this place of devious merchants, deceitful interpreters, costly courtesans, earthquakes, and typhoons comes Jacob de Zoet, a devout and resourceful young clerk who has five years in the East to earn a fortune of sufficient size to win the hand of his wealthy fiancée back in Holland.  But Jacob’s original intentions are eclipsed after a chance encounter with Orito Aibagawa, the disfigured daughter of a samurai doctor and midwife to the city’s powerful magistrate. The borders between propriety, profit, and pleasure blur until Jacob finds his vision clouded, one rash promise made and then fatefully broken. The consequences will extend beyond Jacob’s worst imaginings. As one cynical colleague asks, “Who ain’t a gambler in the glorious Orient, with his very life?”  A magnificent mix of luminous writing, prodigious research, and heedless imagination, The Thousand Autumns of Jacob de Zoet is the most impressive achievement of its eminent author.  Praise for The Thousand Autumns of Jacob de Zoet     “A page-turner . . . [David] Mitchell’s masterpiece; and also, I am convinced, a masterpiece of our time.”—Richard Eder, The Boston Globe     “An achingly romantic story of forbidden love . . . Mitchell’s incredible prose is on stunning display. . . . A novel of ideas, of longing, of good and evil and those who fall somewhere in between [that] confirms Mitchell as one of the more fascinating and fearless writers alive.”—Dave Eggers, The New York Times Book Review     “The novelist who’s been showing us the future of fiction has published a classic, old-fashioned tale . . . an epic of sacrificial love, clashing civilizations and enemies who won’t rest until whole family lines have been snuffed out.”—Ron Charles, The Washington Post     “By any standards, The Thousand Autumns of Jacob de Zoet is a formidable marvel.”—James Wood, The New Yorker     “A beautiful novel, full of life and authenticity, atmosphere and characters that breathe.”—Maureen Corrigan, NPR  Look for special features inside. Join the Random House Reader’s Circle for author chats and more.   From the Trade Paperback edition."
